country,hormuz_share_pct,bypass_pipeline,bypass_capacity_mbd,bypass_spare_mbd,observed_output_cut_pct,source_note,hormuz_mbd,structural_retention,observed_retention,exante_index,expost_index,pred_exante,pred_expost,actual,hit_exante,hit_expost
Saudi Arabia,37.2,East-West (Petroline),5.0,3.5,20,EIA/Vortexa Q1-2025 share; IEA 2026 bypass range 3.5-5.5 mbd combined KSA+UAE,5.282400000000001,0.6625776162350445,0.8,1.0528772432985005,1.2712500000000002,up,up,up,True,True
Iraq,22.8,none,0.0,0.0,70,EIA/Vortexa Q1-2025; no operational bypass (Kirkuk-Ceyhan not Gulf-connected),3.2376,0.0,0.30000000000000004,0.0,0.4767187500000001,down,down,down,True,True
United Arab Emirates,12.9,ADCOP (Habshan-Fujairah),1.8,1.4,55,"EIA/Vortexa Q1-2025; ADCOP nameplate 1.8 mbd, partially pre-utilised",1.8317999999999999,0.7642755759362376,0.44999999999999996,1.2144816573861776,0.7150781249999999,up,down,down,False,True
Iran,10.6,none,0.0,0.0,0,EIA/Vortexa Q1-2025; retained strait access as the controlling party,1.5051999999999999,1.0,1.0,1.5890625,1.5890625,up,up,up,True,True
Kuwait,10.1,none,0.0,0.0,60,EIA/Vortexa Q1-2025; no bypass infrastructure,1.4342,0.0,0.4,0.0,0.6356250000000001,down,down,down,True,True
Qatar,5.0,none,0.0,0.0,65,Residual of top-5 (93.6%); crude/condensate only. LNG force majeure declared separately,0.71,0.0,0.35,0.0,0.556171875,down,down,down,True,True
Bahrain and other,1.4,none,0.0,0.0,60,Residual,0.19879999999999998,0.0,0.4,0.0,0.6356250000000001,down,down,,False,False
